article_id,article_title,abstract_text,annotations
37292004,"Information shocks and celebrity exposure: The effect of ""Magic"" Johnson on AIDS diagnoses and mortality in the U.S.","We present evidence that Earvin ""Magic"" Johnson's announcement that he contracted HIV served as a public-health catalyst for rapidly correcting the public's understanding of who was at risk of infection. Using a novel identification strategy, we present evidence that there was a large but temporary increase in the number of AIDS diagnoses for heterosexual men following the announcement. This effect was concentrated in areas with greater prior exposure to Johnson. We show that these men were both more likely to have been diagnosed via a formal blood test and less likely to die within 1 decade of their initial diagnosis-suggesting that Johnson's announcement caused an intertemporal substitution in testing which prolonged patients' lifespans as a result of earlier access to medical care. We estimate that Johnson's announcement caused approximately 800 additional heterosexual males in the United States in metropolitan statistical areas with National Basketball Association franchises men to discover their underlying AIDS diagnosis and, of whom, were more likely to live at least 1 decade beyond their initial diagnosis date.","[('aids', 'disease', 326, 330), ('basketball', 'sport', 960, 970), ('aids', 'disease', 1027, 1031)]"
37520793,Media Framing of Women's Football During the COVID-19 Pandemic.,"This article examines British media coverage of women's association football during the coronavirus (COVID-19) pandemic, to identify how the media framed the women's game and how these frames could shape the public perceptions of it. Through a database search of British-based news coverage of women's football, 100 news articles were identified in the first 6 months after the start of the pandemic. A thematic analysis was conducted, and five dominant frames were detected in the context of COVID-19: 1) ; 2) ; 3)  (e.g., alterations to national and international competitions); 4)  and 5)  (e.g., welfare, uncertain working conditions). These frames depart from the past trivialisation and sexualisation of women's sport, demonstrate the increased visibility of women's football, and shift the narrative towards the elite stratum of the game. Most of this reporting was by women journalists, while men were shown to write less than women about women's football. This research advocates continued diversification of the sports journalism workforce to dissolve the hegemonic masculine culture that still largely dominates the industry.","[('football', 'sport', 68, 76), ('covid-19)', 'disease', 101, 110), ('football', 'sport', 302, 310), ('covid-19', 'disease', 493, 501), ('football', 'sport', 773, 781), ('football', 'sport', 955, 963)]"
36844988,Chiropractic Management of Chronic Ankle Pain and Limited Mobility in a Pediatric Athlete: A Case Report.,"The purpose of this case study was to report the chiropractic management of a teenage athlete who had chronic pain after a lateral ankle sprain.A 15-year-old male patient presented with persistent ankle pain due to an inversion sprain while playing soccer approximately 8.5 months prior. Emergency department records noted a left lateral ankle sprain, including the anterior talofibular ligament, calcaneofibular ligament, and posterior talofibular ligament. The examination revealed ankle tenderness upon palpation, limited active and passive dorsiflexion range of motion, restricted talocrural joint posterior glide, and moderate lateral compartment muscular hypertonicity.Chiropractic management included high-velocity, low-amplitude chiropractic ankle manipulation and education on home-based ankle dorsiflexion stretching. After 4 treatments, the athlete returned to unencumbered athletic participation. Follow-up evaluation at 5 months revealed no pain or functional complaints.This teen athlete's chronic pain from a lateral ankle sprain resolved with a short course of chiropractic manipulation coupled with home-based stretching.","[('chronic pain', 'disease', 102, 114), ('soccer', 'sport', 249, 255), ('muscular hypertonicity', 'disease', 652, 674), ('chronic pain', 'disease', 1004, 1016)]"
37956908,Successful Treatment of Early Ischemic Contracture in the Upper Arm Caused by Traumatic Hematoma Through Surgical Muscle Release and Continuous Passive Motion: Case Report.,"Compartment syndrome is a condition that occurs when there is an increase in pressure within a muscle compartment, leading to a decrease in blood flow to the muscles and nerves within that compartment. If left untreated, this can lead to ischemic contracture, which is a late sequelae of compartment syndrome that occurs when there is sustained ischemic damage to the muscles. Timely diagnosis and treatment are critical in reducing the extent of permanent changes within muscle and nerve tissue. No previously published studies have reported on the treatment of early ischemic contracture resulting from traumatic hematoma in the upper arm. We present an exceptional case involving a 17-year-old male who developed this condition following a collision during a basketball game, resulting in a hematoma with severe pain, tightness, and restricted range of motion in the affected arm. He was treated through surgical intervention involving surgical muscle release, hematoma evacuation, and continuous passive motion (CPM) postoperatively to restore the range of motion and improve overall function with complete recovery at the 27-month follow-up.","[('compartment syndrome', 'disease', 0, 20), ('ischemic contracture', 'disease', 238, 258), ('compartment syndrome', 'disease', 288, 308), ('ischemic damage to the muscles', 'disease', 345, 375), ('ischemic contracture', 'disease', 569, 589), ('traumatic hematoma', 'disease', 605, 623), ('basketball', 'sport', 762, 772), ('hematoma', 'disease', 794, 802)]"
37486253,Adductor longus and brevis lesion in an amateur soccer player: platelet rich plasma and multifractioned hyaluronic acid injections to enhance clinical recovery.,"Groin pain is a common issue in athletes, with a particularly high incidence in male soccer players. Adductor muscles are the most involved site of the groin, accounting for up to one-fourth of muscle injuries of that region. Physical therapy and rehabilitation programs for adductor-related groin pain using active exercises are effective in getting athletes back to sport. However, the return-to-play time varies according to the injury severity. Minor lesions can recover in 1-2 weeks, while severer injuries require 8-12 weeks. To enhance tendon healing and shorten the return to play time, intrandentinous injections of Platelet Rich Plasma (PRP) have been proposed. An increasing body of evidence in literature have shown efficacy of platelet rich plasma in aiding the healing process in tendinopathies. Similarly, more recent evidences have proven hyaluronic (HA) acid to have anti-inflammatory, proliferative, repairing, and analgesic effects. This case report presents the clinical application of combined PRP and a multifractioned (a mixture of different molecular weights) HA in a 24-year-old athlete suffering from a hip adductor rupture.","[('groin pain', 'disease', 0, 10), ('soccer', 'sport', 85, 91), ('muscle injuries', 'disease', 194, 209), ('adductor-related groin pain', 'disease', 275, 302), ('groin pain', 'disease', 292, 302), ('tendinopathies', 'disease', 794, 808), ('hip adductor rupture', 'disease', 1129, 1149)]"
36844000,Football training as a non-pharmacological treatment of the global aging population-A topical review.,"In the present topical mini-review, the beneficial impact of small-sided game football training for the increasing elderly global population is presented. As a multicomponent type of physical activity, football training executed on small pitched with 4-6 players in each team is targeting a myriad of physiological systems and causes positive adaptations of relevance for several non-communicable diseases, of which the incidence increases with advancing age. There is strong scientific evidence that this type of football training promotes cardiovascular, metabolic and musculo-skeletal health in elderly individuals. These positive adaptations can prevent cardiovascular disease, type 2 diabetes, sarcopenia and osteoporosis, and lower the risk of falls. Also, football training has been proven an efficient part of the treatment of several patient groups including men with prostate cancer and women after breast cancer. Finally, regular football training has an anti-inflammatory effect and may slow the biological aging. Overall, there is a growing body of evidence suggesting that recreational football training can promote health in the elderly.","[('football', 'sport', 78, 86), ('football', 'sport', 202, 210), ('football', 'sport', 514, 522), ('cardiovascular disease', 'disease', 658, 680), ('type 2 diabetes', 'disease', 682, 697), ('sarcopenia', 'disease', 699, 709), ('osteoporosis', 'disease', 714, 726), ('football', 'sport', 763, 771), ('prostate cancer', 'disease', 877, 892), ('breast cancer', 'disease', 909, 922), ('football', 'sport', 941, 949), ('football', 'sport', 1100, 1108)]"
37574608,In-depth mass spectrometry analysis of rhGH administration altered energy metabolism and steroidogenesis.,"Growth hormone, as a proteohormone, is primarily known of its dramatic effect on longitudinal growth. Recombinant DNA technology has provided a safe, abundant and comparatively cheap supply of human GH for growth hormone-deficient individuals. However, many healthy subjects, especially athletics, administrate GH for enhanced athletic performance or strength. A better and more comprehensive understanding of rhGH effect in healthy individuals is urgent and essential. In this study, we recruited 14 healthy young male and injected rhGH once. Untargeted LC-MS metabolomics profiling of serum and urine was performed before and after the rhGH injection. The GH-induced dysregulation of energy related pathways, such as amino acid metabolism, nucleotide metabolism, glycolysis and TCA cycle, was revealed. Moreover, individuals supplemented with micro-doses of rhGH exhibited significantly changed urinary steroidal profiles, suggesting a role of rhGH in both energy metabolism and steroidogenesis. We expect that our results will be helpful to provide new evidence on the effects of rhGH injection and provide potential biomarkers for rhGH administration.","[('growth hormone-deficient', 'disease', 206, 230), ('athletics', 'sport', 287, 296)]"
37255640,Mallet Finger Autofusion in Adolescent Post-Pin Fixation Surgery - A Case Report.,"Mallet finger is a common hand injury in sports in which the terminal extensor tendon is disrupted. This case report describes the rare occurrence of joint autofusion following surgical fixation of an unstable mallet finger injury.We present a case of a 13-year-old right-hand dominant boy who sustained a right long finger bony mallet injury while playing football. Treatment consisted of closed reduction, percutaneous pinning of the right long finger distal interphalangeal (DIP) joint. He went on to heal with residual DIP joint stiffness and only 20° of residual motion that were noted on the early follow-up. Seven years later, he presented with no motion at the right long finger DIP joint. X-rays of his right long finger showed a complete fusion of bone across the DIP joint.Autofusion as a complication of mallet finger surgery is an unprecedently rare finding, especially in the absence of any predisposing factors. This complication must be considered when treating mallet finger injuries through surgical intervention. Fortunately, the loss of DIP motion, complete in this case, had no long-term effect on the overall use of this patient's hand.","[('hand injury', 'disease', 26, 37), ('mallet finger injury', 'disease', 210, 230), ('right long finger bony mallet injury', 'disease', 306, 342), ('football', 'sport', 357, 365), ('mallet finger injuries', 'disease', 978, 1000)]"
37705566,External Iliac Artery Endofibrosis: A Discussion on Two Unique Cases.,"Iliac artery endofibrosis (IAE), as the name suggests, involves subintimal fibrosis of the iliac artery. IAE is most commonly associated with competitive athletics, particularly cycling, and remains a rather underappreciated diagnosis in the clinical setting. We present two unique and distinct presentations of IAE in competitive athletes. The first case involves a 38-year-old male cyclist who initially presented with complaints of a bulge at the right groin and acute onset monoplegia and paresthesia associated with exertion of the right lower extremity. This patient was referred to vascular surgery and underwent right common iliac artery and proximal common femoral artery endarterectomy with patch angioplasty and Fogarty embolectomy. Case 2 involves a 50-year-old female triathlete who presented with left lower extremity claudication of a more chronic course, with symptoms beginning approximately four years prior. The pain radiated to her upper thigh and was associated with exertion, restricting her exercise tolerance and return to training. After a diagnosis of IAE was made, she was referred to vascular surgery for a left iliofemoral bypass.","[('iliac artery endofibrosis', 'disease', 0, 25), ('iae', 'disease', 27, 30), ('subintimal fibrosis of the iliac artery', 'disease', 64, 103), ('iae', 'disease', 105, 108), ('athletics', 'sport', 154, 163), ('cycling', 'sport', 178, 185), ('iae', 'disease', 312, 315), ('bulge at the right groin', 'disease', 437, 461), ('acute onset monoplegia', 'disease', 466, 488), ('monoplegia', 'disease', 478, 488), ('paresthesia', 'disease', 493, 504), ('exertion of the right lower extremity', 'disease', 521, 558), ('left lower extremity claudication', 'disease', 811, 844), ('iae', 'disease', 1078, 1081)]"
37739576,Long-term risk of cardiovascular disease after traumatic brain injury: screening and prevention.,"Traumatic brain injury (TBI) is highly prevalent among individuals participating in contact sports, military personnel, and in the general population. Although it is well known that brain injury can cause neurological and psychiatric complications, evidence from studies on individuals exposed to a single or repetitive brain injuries suggests an understudied association between TBI and the risk of developing chronic cardiovascular diseases and risk factors for cardiovascular disease. Several studies have shown that people without pre-existing comorbidities who sustain a TBI have a significantly higher risk of developing chronic cardiovascular disease, than people without TBI. Similar observations made in military and professional American-style football cohorts suggest causal pathways through which modifiable cardiovascular risk factors might mediate the relationship between brain injury and chronic neurological diseases. A better understanding of cardiovascular disease risk after TBI combined with a proactive, targeted screening programme might mitigate long-term morbidity and mortality in individuals with TBI, and improve their quality of life.","[('traumatic brain injury', 'disease', 0, 22), ('tbi', 'disease', 24, 27), ('brain injury', 'disease', 182, 194), ('neurological and psychiatric complications', 'disease', 205, 247), ('brain injuries', 'disease', 320, 334), ('tbi', 'disease', 380, 383), ('chronic cardiovascular diseases', 'disease', 411, 442), ('cardiovascular disease', 'disease', 464, 486), ('tbi', 'disease', 576, 579), ('chronic cardiovascular disease', 'disease', 627, 657), ('tbi', 'disease', 679, 682), ('american-style football', 'sport', 739, 762), ('cardiovascular risk', 'disease', 820, 839), ('brain injury', 'disease', 887, 899), ('chronic neurological diseases', 'disease', 904, 933), ('cardiovascular disease', 'disease', 961, 983), ('tbi', 'disease', 995, 998), ('tbi', 'disease', 1124, 1127)]"
36924828,Return to sports following distal biceps tendon repair: A current concepts review.,"Distal biceps tendon ruptures are relatively rare injuries but tend to occur in active and athletic populations, especially in weightlifting and contact sports. The distal biceps tendon is an important supinator of the forearm and flexor of the elbow, thus an injury to this ligament can be invalidating for athletes. The aim of this review was to determine the ability and the time to return to sports following distal biceps tendon repair in athletes and the level of performance. The literature is scarce about the return to sports among athletes. Most studies include athletes are National Football League (NFL) players, others are weightlifters and a few recreational athletes. The return to play rate after distal biceps tendon repair is high. The performances of the returned players were similar to matched players and most players returned to the same level. Most players-depending on the sport-were not able to return to competition within the same season. In order to manage expectations, it should be discussed preoperatively with the athlete (and their coach) that the return to sports rate is high, but the return will probably be the following season.","[('distal biceps tendon ruptures', 'disease', 0, 29), ('weightlifting', 'sport', 127, 140), ('football', 'sport', 594, 602)]"
37812954,Prevention of shoulder injuries in volleyball players: The usefulness and efficiency of a warm-up routine.,"The objective of this study was to assess the efficiency of a warm-up routine focused on shoulder injury prevention in volleyball players.Prospective study.University.Eight recreational volleyball teams (44 males, 49 females) were included in the study and assigned to two different groups (prevention or control) in a blinded way. In the prevention group, the players had to perform specific exercises at the beginning of each training session twice a week.Injuries were recorded monthly in both groups with an online questionnaire.A significant decrease in the total number of injuries as well as in the severity of the injuries was observed in the prevention group in comparison to the control group (p = 0.0001-0.013). For the shoulder, a decrease in injury incidence was also observed in the prevention group. This decrease reached significance in male players (p = 0.045).The program appears to be efficient to reduce the risk of shoulder injuries in recreational volleyball players. Adjustments in the duration and in the contents of the program will have to be made to further improve compliance and better meet the requirements of both players and trainers.","[('shoulder injury', 'disease', 89, 104), ('volleyball', 'sport', 119, 129), ('volleyball', 'sport', 186, 196), ('shoulder injuries', 'disease', 936, 953), ('volleyball', 'sport', 970, 980)]"
36863405,Relationship Between Body Size and Skeletal Age with Muscle Damage in Young Soccer Players.,"This study verified the relationship between body size and skeletal age (SA) with the behavior of blood markers of muscle damage and delayed onset muscle soreness (DOMS) after a soccer match in the U-13 and U-15 categories. The sample consisted of 28 soccer players in the U-13 and 16 in the U-15 categories. Creatine kinase (CK), lactate dehydrogenase (LDH), and DOMS were evaluated up to 72 h after the match. Muscle damage was elevated at 0 h in U-13, and from 0 h to 24 h in U-15. DOMS increased from 0 h to 72 h in U-13 and from 0 h to 48 h in U-15. Significant associations of SA and fat-free mass (FFM) with muscle damage markers and DOMS were observed only in U-13, specifically at time 0 h, when SA explained 56% of CK and 48% of DOMS and FFM explained 48% of DOMS. We concluded that in the U-13 category, higher SA is significantly associated with muscle damage markers, and increase in FFM is associated with muscle damage markers and DOMS. Furthermore, U-13 players need 24 h to recover pre-match muscle damage markers and more than 72 h to recover DOMS. In contrast, the U-15 category needs 48 h to recover muscle damage markers and 72 h to recover DOMS.","[('muscle damage', 'disease', 115, 128), ('delayed onset muscle soreness', 'disease', 133, 162), ('doms', 'disease', 164, 168), ('soccer', 'sport', 178, 184), ('soccer', 'sport', 251, 257), ('doms', 'disease', 364, 368), ('muscle damage', 'disease', 412, 425), ('doms', 'disease', 485, 489), ('muscle damage', 'disease', 615, 628), ('doms', 'disease', 641, 645), ('doms', 'disease', 739, 743), ('doms', 'disease', 769, 773), ('muscle damage', 'disease', 858, 871), ('muscle damage', 'disease', 920, 933), ('doms', 'disease', 946, 950), ('muscle damage', 'disease', 1009, 1022), ('doms', 'disease', 1061, 1065), ('muscle damage', 'disease', 1120, 1133), ('doms', 'disease', 1162, 1166)]"
37991574,A 5-year follow-up of Achilles tendon reconstruction using a full-thickness graft processed with the clearant method and retrograde fixation in the calcaneus: a case study of an amateur soccer player.,"We present a case of a 41-year-old male amateur soccer player with no comorbidities, who experienced a rerupture of the Achilles tendon 5 years after his initial end-to-end plasty. To address this, we opted for a full-thickness reconstruction using a graft under the Clearant Process of the Achilles tendon. As an innovative approach, we proposed an alternative fixation technique, employing a Bio Composite Arthrex 9 mm x 35 mm interference screw, placed at the apex of the calcaneus body. For a period of 5 years, the patient underwent regular imaging follow-ups with Magnetic Resonance Imaging (MRI) and clinical assessments using the Foot and Ankle Ability Measure Activity Subscale Score and Foot and Ankle Ability Measure Sports Subscale Score. This case highlights the importance of exploring novel fixation methods for Achilles tendon reconstruction, particularly in cases of rerupture. The use of the Bio Composite Arthrex screw, in conjunction with the Clearant Process graft, demonstrated promising results both in imaging and functional outcomes, but more case studies with positive results are needed to evaluate the effectiveness of this reconstruction.","[('soccer', 'sport', 48, 54), ('rerupture of the achilles tendon', 'disease', 103, 135)]"
37508703,The Effects of FIFA 11+ Kids Prevention Program on Kinematic Risk Factors for ACL Injury in Preadolescent Female Soccer Players: A Randomized Controlled Trial.,"This study aimed to investigate the effects of the 8-week FIFA 11+ Kids program on kinematic risk factors for ACL injury in preadolescent female soccer players during single-leg drop landing. For this, 36 preadolescent female soccer players (10-12 years old) were randomly allocated to the FIFA 11+ Kids program and control groups (18 players per group). The intervention group performed the FIFA 11+ Kids warm-up program twice per week for 8 weeks, while the control group continued with regular warm-up. Trunk, hip, and knee peak angles (from initial ground contact to peak knee flexion) were collected during the single-leg drop landing using a 3D motion capture system. A repeated measure ANOVA was used to analyze groups over time. Significant group × time interactions were found for the peak knee flexion, with a medium effect size ( = 0.05; effect size = 0.11), and peak hip internal rotation angles, with a large effect size ( < 0.01; effect size = 0.28). We found that the FIFA 11+ Kids program was effective in improving knee flexion and hip internal rotation, likely resulting in reducing ACL stress during single-leg drop landing in young soccer players.","[('acl injury', 'disease', 110, 120), ('soccer', 'sport', 145, 151), ('soccer', 'sport', 226, 232), ('acl stress', 'disease', 1101, 1111), ('soccer', 'sport', 1152, 1158)]"
37071508,Interprofessional Team Collaboration for Routine and Emergent Mental Health Concerns Among Collegiate Student-Athletes: A Case Series from the Association for Athletic Training Education Research Network.,"Collegiate student-athletes experience an increasing number of mental health concerns. To help address these concerns and provide high-quality health care for student-athletes, institutions of higher education are being encouraged to create interprofessional health care teams that are specifically dedicated to managing mental health. We interviewed 3 interprofessional health care teams who collaborate to manage routine and emergency mental health conditions in collegiate student-athletes. Teams represented all 3 National Collegiate Athletics Association (NCAA) divisions and included athletic trainers, clinical psychologists, psychiatrists, dietitians and nutritionists, social workers, nurses, and physician assistants (associates). The interprofessional teams indicated that the existing NCAA recommendations helped to solidify members and roles of the mental health care team; however, they all believed their teams would benefit from more counselors and psychiatrists. Teams had different mechanisms for referral and accessing mental health resources on their campuses, which may make on-the-job training for new members of the team an organizational necessity.","[('athletics', 'sport', 538, 547)]"
